{
  "ase_version": "0.1",
  "vendor": "example",
  "model": "band-2",
  "firmware": "3.4.1",
  "tiers": [
    "t0",
    "t1"
  ],
  "profiles": [
    "akasara.align.v1"
  ],
  "signal": {
    "kind": "semg",
    "channels": 16,
    "sample_rate_hz": 2000,
    "montage": {
      "system": "ase.limb.v1",
      "site": "forearm-proximal",
      "side": "right",
      "arrangement": "circumferential",
      "reference": "differential-adjacent",
      "positions": [
        {
          "ch": 0,
          "angle_deg": 0,
          "axial_mm": 60
        },
        {
          "ch": 1,
          "angle_deg": 22.5,
          "axial_mm": 60
        },
        {
          "ch": 2,
          "angle_deg": 45,
          "axial_mm": 60
        },
        {
          "ch": 3,
          "angle_deg": 67.5,
          "axial_mm": 60
        },
        {
          "ch": 4,
          "angle_deg": 90,
          "axial_mm": 60
        },
        {
          "ch": 5,
          "angle_deg": 112.5,
          "axial_mm": 60
        },
        {
          "ch": 6,
          "angle_deg": 135,
          "axial_mm": 60
        },
        {
          "ch": 7,
          "angle_deg": 157.5,
          "axial_mm": 60
        },
        {
          "ch": 8,
          "angle_deg": 180,
          "axial_mm": 60
        },
        {
          "ch": 9,
          "angle_deg": 202.5,
          "axial_mm": 60
        },
        {
          "ch": 10,
          "angle_deg": 225,
          "axial_mm": 60
        },
        {
          "ch": 11,
          "angle_deg": 247.5,
          "axial_mm": 60
        },
        {
          "ch": 12,
          "angle_deg": 270,
          "axial_mm": 60
        },
        {
          "ch": 13,
          "angle_deg": 292.5,
          "axial_mm": 60
        },
        {
          "ch": 14,
          "angle_deg": 315,
          "axial_mm": 60
        },
        {
          "ch": 15,
          "angle_deg": 337.5,
          "axial_mm": 60
        }
      ]
    }
  },
  "t1": {
    "feature_space": "example.band2.tdfeat.v3",
    "dim": 8,
    "window_ms": 200,
    "stride_ms": 50,
    "producer": "dsp",
    "adaptive": false,
    "documentation": "https://example.com/ase/tdfeat-v3",
    "latency_typ_ms": 12,
    "latency_max_ms": 28,
    "lossless_encodings": [
      "f32"
    ]
  },
  "clock": {
    "rtc": false,
    "mono_epoch": "boot",
    "drift_ppm_max": 40
  },
  "selftest": {
    "input": "ase.selftest.v1",
    "expected": [
      -0.962833,
      -0.962579,
      -0.961893,
      -0.964754,
      -0.963061,
      -0.962078,
      -0.962346,
      -0.963352
    ],
    "tolerance": 0.0001
  },
  "don_count": 41,
  "transport": [
    {
      "uri": "usb-cdc",
      "encodings": [
        "abf",
        "json"
      ],
      "max_sustained_kbps": 8000
    },
    {
      "uri": "ble://0001cd2c-3660-4e38-98ea-18dca6f5b514",
      "encodings": [
        "abf"
      ],
      "phy": "2M",
      "max_sustained_kbps": 250
    }
  ],
  "requires_account": false,
  "requires_network": false,
  "developer_gate": false,
  "terms": {
    "cross_user_processing_permitted": true,
    "url": "https://example.com/ase/terms"
  }
}
