{
  "ase_version": "0.1",
  "vendor": "example",
  "model": "band-2",
  "firmware": "3.4.1",
  "tiers": [
    "t0",
    "t1"
  ],
  "profiles": [],
  "signal": {
    "kind": "semg",
    "channels": 4,
    "sample_rate_hz": 2000,
    "montage": {
      "system": "ase.limb.v1",
      "site": "forearm-proximal",
      "side": "right",
      "arrangement": "circumferential",
      "reference": "differential-adjacent",
      "positions": [
        {
          "ch": 0,
          "angle_deg": 0,
          "axial_mm": 60
        },
        {
          "ch": 1,
          "angle_deg": 22.5,
          "axial_mm": 60
        },
        {
          "ch": 2,
          "angle_deg": 45,
          "axial_mm": 60
        },
        {
          "ch": 3,
          "angle_deg": 67.5,
          "axial_mm": 60
        }
      ]
    }
  },
  "t1": {
    "feature_space": "example.band2.tdfeat.v3",
    "dim": 8,
    "layout": "feature-major",
    "window_ms": 200,
    "stride_ms": 50,
    "producer": "dsp",
    "adaptive": false,
    "documentation": "https://example.com/ase/tdfeat-v3",
    "latency_typ_ms": 12,
    "latency_max_ms": 28,
    "lossless_encodings": [
      "f32"
    ],
    "cross_user_margin": {
      "margin": 0.153,
      "ci_low": 0.121,
      "ci_high": 0.184,
      "task": "calibration-free cross-subject retrieval of held-out gestures, 52-way",
      "subjects": 6,
      "bootstrap_unit": "subject"
    }
  },
  "t0": {
    "event_space": "example.band2.grip.v2",
    "events": [
      {
        "code": 1,
        "label": "rest"
      },
      {
        "code": 2,
        "label": "power_grip"
      },
      {
        "code": 3,
        "label": "pinch"
      },
      {
        "code": 4,
        "label": "wrist_extension"
      }
    ],
    "derived_from_t1": true,
    "confidence": true,
    "documentation": "https://example.com/ase/grip-classifier-v2"
  },
  "clock": {
    "rtc": false,
    "mono_epoch": "boot",
    "drift_ppm_max": 40
  },
  "selftest": {
    "input": "ase.selftest.v1",
    "expected": [
      -0.962833,
      -0.962579,
      -0.961893,
      -0.964754,
      -0.963061,
      -0.962078,
      -0.962346,
      -0.963352
    ],
    "tolerance": 0.0001
  },
  "don_count": 41,
  "transport": [
    {
      "uri": "usb-cdc",
      "encodings": [
        "abf",
        "json"
      ],
      "max_sustained_kbps": 8000
    },
    {
      "uri": "ble://0001cd2c-3660-4e38-98ea-18dca6f5b514",
      "encodings": [
        "abf"
      ],
      "phy": "2M",
      "max_sustained_kbps": 250
    }
  ],
  "requires_account": false,
  "requires_network": false,
  "developer_gate": false,
  "terms": {
    "cross_user_processing_permitted": true,
    "url": "https://example.com/ase/terms"
  }
}
